name,,source,comments
@diamondlion47,,https://www.youtube.com/watch?v=Y_EAlxWNQN8&lc=UgxwthuOmINfasiPyHp4AaABAg,Trade is moving away from the US and prices will go up.  What a dumb country we are.
@MrAFatMan9991,,https://www.youtube.com/watch?v=Y_EAlxWNQN8&lc=UgwSP3rNBQRhlDgTW2Z4AaABAg,"The word ""may"" is doing some HEAVY lifting there, it's not up for debate, it WILL be worse for everyone but mostly worse for Americans."
@Michael-lt4zf,,https://www.youtube.com/watch?v=Y_EAlxWNQN8&lc=UgykojV15ND6lPU_TRt4AaABAg,Negotiators always put out upbeat statements about “progress.”
@bluemoon8498,,https://www.youtube.com/watch?v=Y_EAlxWNQN8&lc=UgzaZheO8amsUEdpRjN4AaABAg,Trump king of bankruptcies
@wshwe,,https://www.youtube.com/watch?v=Y_EAlxWNQN8&lc=UgzDzuk7BHzSHgW2a0d4AaABAg,America Last is the MAGA Kingpin's economic strategy!
@yuckmouth,,https://www.youtube.com/watch?v=Y_EAlxWNQN8&lc=UgyZ17dVflAUILT0ysV4AaABAg,No doubt.
@bluemoon8498,,https://www.youtube.com/watch?v=Y_EAlxWNQN8&lc=UgzaZheO8amsUEdpRjN4AaABAg,Trump king of bankruptcies
@wshwe,,https://www.youtube.com/watch?v=Y_EAlxWNQN8&lc=UgzDzuk7BHzSHgW2a0d4AaABAg,America Last is the MAGA Kingpin's economic strategy!
@yuckmouth,,https://www.youtube.com/watch?v=Y_EAlxWNQN8&lc=UgyZ17dVflAUILT0ysV4AaABAg,No doubt.
@troyboyd3100,,https://www.youtube.com/watch?v=Y_EAlxWNQN8&lc=Ugy0k8UBGVsDiIVds_54AaABAg,"If America wants to minimise their trade imbalance, maybe they should stop consuming so much?"
@wrk.6665,,https://www.youtube.com/watch?v=Y_EAlxWNQN8&lc=UgzuYT0OvN3paYwuPsB4AaABAg,Has an “expert” been correct about anything in the last 5 years?
@povpooh,,https://www.youtube.com/watch?v=Y_EAlxWNQN8&lc=UgzNe4t1iG035JDCcVR4AaABAg,Finally a guest with proper internet connection
@storyteller0607,,https://www.youtube.com/watch?v=Y_EAlxWNQN8&lc=UgwCiAcfdL-Ox4NkGfd4AaABAg,it must be bad. But can Germany brave enough to say no?
@findaxelfoley8106,,https://www.youtube.com/watch?v=Y_EAlxWNQN8&lc=UgzKepRt9N9e4kKKhfx4AaABAg,THEY MADE HIS HAND SO SMALL IN THE THUMBNAIL
@agritech802,,https://www.youtube.com/watch?v=Y_EAlxWNQN8&lc=UgyneS8iWrDr3T6RBVN4AaABAg,"Great interview, thanks for sharing"
@Iammrunkown,,https://www.youtube.com/watch?v=Y_EAlxWNQN8&lc=UgzL3LvQOiCazbMcUvN4AaABAg,Fell for It Again Award
@pablo_quito,,https://www.youtube.com/watch?v=Y_EAlxWNQN8&lc=Ugy_Pto6mcBO1032o0Z4AaABAg,She should be interviewed more! I love the experts DW invites.
@findaxelfoley8106,,https://www.youtube.com/watch?v=Y_EAlxWNQN8&lc=UgzKepRt9N9e4kKKhfx4AaABAg,THEY MADE HIS HAND SO SMALL IN THE THUMBNAIL
@agritech802,,https://www.youtube.com/watch?v=Y_EAlxWNQN8&lc=UgyneS8iWrDr3T6RBVN4AaABAg,"Great interview, thanks for sharing"
@Iammrunkown,,https://www.youtube.com/watch?v=Y_EAlxWNQN8&lc=UgzL3LvQOiCazbMcUvN4AaABAg,Fell for It Again Award
@pablo_quito,,https://www.youtube.com/watch?v=Y_EAlxWNQN8&lc=Ugy_Pto6mcBO1032o0Z4AaABAg,She should be interviewed more! I love the experts DW invites.
@emikomina,,https://www.youtube.com/watch?v=Y_EAlxWNQN8&lc=UgxceBvh1LN0Td0iGLx4AaABAg,"Trump is a fool. Japan has 0 tariffs on any foreign cars. Over 50% of all cars sold in Japan are Kei cars/mini cars, how can he expect Ford and GM to sell their cars in Japan if they don't even bother to make cars that most Japanese will buy? Since most, if not all, foreign automakers don't make kei cars, the only foreign cars that sell in Japan are luxury cars. So the only American cars that Trump should expect to sell in Japan are like Cadillac, but even then German luxury cars are much better which is why Mercedes, BMW, and Porsche, sell a lot in Japan"
@MMCHILLS,,https://www.youtube.com/watch?v=Y_EAlxWNQN8&lc=UgwsWXA7h7ZDaTCVPi94AaABAg,Really? You all didn’t see this coming? You pay for the tariffs  hellooooooo!!!!
@c.a.savage5689,,https://www.youtube.com/watch?v=Y_EAlxWNQN8&lc=Ugxzi1V0ckrsZtpFuAt4AaABAg,"Trump's Tariff Trampoline. Any country that can, will trade elsewhere. When will America have had enough of Trump?"
@TabithaTabCat,,https://www.youtube.com/watch?v=Y_EAlxWNQN8&lc=UgwUBLHCwr4m6SdlVD54AaABAg,The rest of the world should just collectively put a 1000% tariff on the US or put the US on a world’s ignore list for trade.
@tef-p8l,,https://www.youtube.com/watch?v=Y_EAlxWNQN8&lc=UgzbAg6_LnnvoLYjmnF4AaABAg,So if USA is in the losing side. Why the noise is coming from EU
@timoooo7320,,https://www.youtube.com/watch?v=Y_EAlxWNQN8&lc=UgyM34RU9NPsM1Elq4N4AaABAg,Incoherence from the Trump administration
@TheKkpop1,,https://www.youtube.com/watch?v=Y_EAlxWNQN8&lc=UgzabDQByKrHARs7aMt4AaABAg,Tariff will cause hyperinflation and recession in US.
@seraphin01,,https://www.youtube.com/watch?v=Y_EAlxWNQN8&lc=UgwttgYC16ShFR4MRSh4AaABAg,"don't worry for trump and his friends though, I'm sure friday they loaded put options on the stock market before announcing that. They'll be richer by hundreds of millions by monday morning."
@stephendtto,,https://www.youtube.com/watch?v=Y_EAlxWNQN8&lc=UgxWlI-HZ6EV2IJUez14AaABAg,Bleats on social media is not negotiating.  The end US consumer pays the tariffs.
@bluehorseshoe6599,,https://www.youtube.com/watch?v=Y_EAlxWNQN8&lc=UgyegiJR_9EqTThwcTV4AaABAg,Haha…. America down the toilet first….. woohoo
@MattSmith-pf5di,,https://www.youtube.com/watch?v=Y_EAlxWNQN8&lc=Ugx7Lc9SCu7cwoN9Zjp4AaABAg&pp=0gcJCSMANpG00pGi,Make your stuff for your people.  I have enough junk
@somaghosh2960,,https://www.youtube.com/watch?v=Y_EAlxWNQN8&lc=Ugywp9SbYfFYTolRkHx4AaABAg,"Important discussion, DW."
@tef-p8l,,https://www.youtube.com/watch?v=Y_EAlxWNQN8&lc=UgzbAg6_LnnvoLYjmnF4AaABAg,So if USA is in the losing side. Why the noise is coming from EU
@TheKkpop1,,https://www.youtube.com/watch?v=Y_EAlxWNQN8&lc=UgzabDQByKrHARs7aMt4AaABAg,Tariff will cause hyperinflation and recession in US.
@seraphin01,,https://www.youtube.com/watch?v=Y_EAlxWNQN8&lc=UgwttgYC16ShFR4MRSh4AaABAg,"don't worry for trump and his friends though, I'm sure friday they loaded put options on the stock market before announcing that. They'll be richer by hundreds of millions by monday morning."
@stephendtto,,https://www.youtube.com/watch?v=Y_EAlxWNQN8&lc=UgxWlI-HZ6EV2IJUez14AaABAg,Bleats on social media is not negotiating.  The end US consumer pays the tariffs.
@bluehorseshoe6599,,https://www.youtube.com/watch?v=Y_EAlxWNQN8&lc=UgyegiJR_9EqTThwcTV4AaABAg,Haha…. America down the toilet first….. woohoo
@MattSmith-pf5di,,https://www.youtube.com/watch?v=Y_EAlxWNQN8&lc=Ugx7Lc9SCu7cwoN9Zjp4AaABAg&pp=0gcJCSMANpG00pGi,Make your stuff for your people.  I have enough junk
@somaghosh2960,,https://www.youtube.com/watch?v=Y_EAlxWNQN8&lc=Ugywp9SbYfFYTolRkHx4AaABAg,"Important discussion, DW."
@john60123,,https://www.youtube.com/watch?v=Y_EAlxWNQN8&lc=UgwSpdkkNgwutghav454AaABAg,"If the world wants to destroy the US and Trump, then sell US Bonds - sell -sell - sell baby!"
@FAFO_MAGA,,https://www.youtube.com/watch?v=Y_EAlxWNQN8&lc=Ugy9j9bmwNgkkyGBW4R4AaABAg,May!?  WILL!!!
@Kandel-v7i,,https://www.youtube.com/watch?v=Y_EAlxWNQN8&lc=Ugz3g_158sc1cezQUYN4AaABAg,From 30 trillions to 33 trillions in less than a year is a growth.
@nah0725,,https://www.youtube.com/watch?v=Y_EAlxWNQN8&lc=Ugyo-G4-JRsr9Kd0XO54AaABAg,It would be good in the long term . People will finally be forced to stop relying on u.s dollars and make a new global currency.
@JustSomeDude9,,https://www.youtube.com/watch?v=Y_EAlxWNQN8&lc=UgxIrmSL5xSuR5LNpdZ4AaABAg,Rump is looking for a kickback. like a free Jet
@thurston905,,https://www.youtube.com/watch?v=Y_EAlxWNQN8&lc=UgyVDqigYtSEfa3gFTN4AaABAg,It’s only bad for the exporting countries. The US consumers can switch to cheaper alternatives. Economics 101.
@sapere7,,https://www.youtube.com/watch?v=Y_EAlxWNQN8&lc=UgxB_5EEL1vVFMZNnXd4AaABAg,"Hey , don’t forget,it’s our daddy  !"
@ashokagarwal78,,https://www.youtube.com/watch?v=Y_EAlxWNQN8&lc=UgxwCvHMrexZdBkSx2t4AaABAg&pp=0gcJCSMANpG00pGi,Some expert had a theory. Sanctions imposed stock market goes down. Then settlement happens stock market up. So sanctions imposed to help TRUMP and company to manipulate market
@elettner,,https://www.youtube.com/watch?v=Y_EAlxWNQN8&lc=UgwiERLFqBGeNgRoxEp4AaABAg,"Talking about doing what is bad for your own country. That's the US"" policy."
@MrDadyD,,https://www.youtube.com/watch?v=Y_EAlxWNQN8&lc=Ugxfd0F7MjQUI4Ajvfx4AaABAg&pp=0gcJCSMANpG00pGi,Just stop allowing EUV lithography exports to the US and lets see how well their chip manufactures does. And add a ban on medicins like Wegovy and Ozempic.
@AK47z,,https://www.youtube.com/watch?v=Y_EAlxWNQN8&lc=Ugzk2wFB4Dd6Lq7NK0t4AaABAg,It maybe bad? The world and us Americans with brains already have already known this for months since the tariffs started.
@marjankeuzenkamp7397,,https://www.youtube.com/watch?v=Y_EAlxWNQN8&lc=Ugzolh56_u9yLGQMDql4AaABAg,A corrupt regime....
@KhrystynaBraverman,,https://www.youtube.com/watch?v=Y_EAlxWNQN8&lc=Ugw8J_7EjIv5rWqpdah4AaABAg&pp=0gcJCSMANpG00pGi,And a Liar!!!
@dovydasorzekauskas7993,,https://www.youtube.com/watch?v=Y_EAlxWNQN8&lc=UgzZrRSrV4XS3x_UtWx4AaABAg,Good luck americans with your groceries :D
@oscarowski,,https://www.youtube.com/watch?v=Y_EAlxWNQN8&lc=UgxhUNp-AXFun2hsYEp4AaABAg,Trump always has a reason to do his things… even if that reason nearly always is made up and makes absolutely no sense.
@StellarStoic,,https://www.youtube.com/watch?v=Y_EAlxWNQN8&lc=UgzVmG6HvL_6REaY6vZ4AaABAg,Is this because people burned his statue in Sevnica
@AK47z,,https://www.youtube.com/watch?v=Y_EAlxWNQN8&lc=Ugzk2wFB4Dd6Lq7NK0t4AaABAg,It maybe bad? The world and us Americans with brains already have already known this for months since the tariffs started.
@marjankeuzenkamp7397,,https://www.youtube.com/watch?v=Y_EAlxWNQN8&lc=Ugzolh56_u9yLGQMDql4AaABAg,A corrupt regime....
@KhrystynaBraverman,,https://www.youtube.com/watch?v=Y_EAlxWNQN8&lc=Ugw8J_7EjIv5rWqpdah4AaABAg&pp=0gcJCSMANpG00pGi,And a Liar!!!
@dovydasorzekauskas7993,,https://www.youtube.com/watch?v=Y_EAlxWNQN8&lc=UgzZrRSrV4XS3x_UtWx4AaABAg,Good luck americans with your groceries :D
@oscarowski,,https://www.youtube.com/watch?v=Y_EAlxWNQN8&lc=UgxhUNp-AXFun2hsYEp4AaABAg,Trump always has a reason to do his things… even if that reason nearly always is made up and makes absolutely no sense.
@StellarStoic,,https://www.youtube.com/watch?v=Y_EAlxWNQN8&lc=UgzVmG6HvL_6REaY6vZ4AaABAg,Is this because people burned his statue in Sevnica
@quickbrown2,,https://www.youtube.com/watch?v=Y_EAlxWNQN8&lc=UgzGUT5KMN8jj3lk4DR4AaABAg,May be?
@Jean.A.squirrel,,https://www.youtube.com/watch?v=Y_EAlxWNQN8&lc=UgxRieK3XhFbwmWBXh54AaABAg,"The company I work for makes copper and brass dies for printing companies.  Sheet of copper, 48x24x.25 inches has gone up a $100 a sheet since January.  Our clients are ordering less dies, we can't push all the cost on our client because their clients don't want to pay it either.  We are losing money by the day.  Had to layoff one employee to help offset the damage.  Keeps up, none of us will have a job come December.   Thanks, Orange Taco."
@entonberg3945,,https://www.youtube.com/watch?v=Y_EAlxWNQN8&lc=UgycvngDP8gJWSWCYZB4AaABAg,Banger title tbh.
@Well___hello,,https://www.youtube.com/watch?v=Y_EAlxWNQN8&lc=Ugw2IGntc4MIZR4UT014AaABAg,EU needs to re-adjust it’s imports-exports and try to avoid American goods as much as EU can.
@autodidactic-i2i,,https://www.youtube.com/watch?v=Y_EAlxWNQN8&lc=UgxFsHNHAQZL_p_3TkV4AaABAg,Voter's remorse 2.0 like never  before
@ikku4321,,https://www.youtube.com/watch?v=Y_EAlxWNQN8&lc=Ugzj2PiVGonj2N9RLtB4AaABAg,"Forget recession, it's a Great Depression 2.0 that we are already looking at."
@americanclip03proud,,https://www.youtube.com/watch?v=Y_EAlxWNQN8&lc=UgyzbOZ3XtB_OvQ1Gd54AaABAg,"They’re coming, many Countries started to invest in the US, more to come….It all takes time…️"
@rwhitenz,,https://www.youtube.com/watch?v=Y_EAlxWNQN8&lc=Ugx9UwY9BBB7HnLITGl4AaABAg,Taco
@CM73878,,https://www.youtube.com/watch?v=Y_EAlxWNQN8&lc=UgxdrfCfd65XbprH_UN4AaABAg,It’s a shame DW presenters are adopting American accents which make them sound like they’re AI
@simonohara9617,,https://www.youtube.com/watch?v=Y_EAlxWNQN8&lc=UgzPu_tR6w2k-CHP98t4AaABAg,Where did the talks break down? Between DJT's ears.
@Crims0nCru5h,,https://www.youtube.com/watch?v=Y_EAlxWNQN8&lc=UgxZPS-fM0c6O5aPcjF4AaABAg,"Trump sure can ""shout"" loud"
@helenamcginty4920,,https://www.youtube.com/watch?v=Y_EAlxWNQN8&lc=Ugz9vmaZZC_uon2xmDF4AaABAg,Trump thinks negociation is he says what he wants and everyone else bends the knee.
@Lindsaybkk,,https://www.youtube.com/watch?v=Y_EAlxWNQN8&lc=UgxBp3HW-DIhbKYc6v14AaABAg,Wilshire 5000 to GDP Ratio   208.7%
@rumanMiah007,,https://www.youtube.com/watch?v=Y_EAlxWNQN8&lc=UgxfGNvMbSjkZP0w5WZ4AaABAg,Nato should avoid US arms to fight against Russia. They should save money for tariffs fight
@robertagarrett7159,,https://www.youtube.com/watch?v=Y_EAlxWNQN8&lc=UgwrDyho4lQGCh0gXWR4AaABAg&pp=0gcJCSMANpG00pGi,Its because the Globfather is insane.
@rumanMiah007,,https://www.youtube.com/watch?v=Y_EAlxWNQN8&lc=UgxfGNvMbSjkZP0w5WZ4AaABAg,Nato should avoid US arms to fight against Russia. They should save money for tariffs fight
@gor4988,,https://www.youtube.com/watch?v=Y_EAlxWNQN8&lc=UgwJlD9IHQ-MJPKT0ex4AaABAg,Unite against trump
@cmsinak,,https://www.youtube.com/watch?v=Y_EAlxWNQN8&lc=UgzGaUxLokWzSRHfis14AaABAg,A failed grifter and we expect something different?
@BelloAlhassan-p4t,,https://www.youtube.com/watch?v=Y_EAlxWNQN8&lc=UgxfRancKDmfnmpE9KN4AaABAg,Tariff and USA HIGH Debts ........
@WoRstVoRt3x,,https://www.youtube.com/watch?v=Y_EAlxWNQN8&lc=Ugyoy0rDHvIqsEFYbVN4AaABAg,"I hate to say it but I feel like we got what we deserved. Too many ignorant ppl were conned by this “business man” and a lot of ppl are burnt out by our divisive domestic politics and just don’t care to vote anymore. This is what we get, I just hate that we’re pulling the rest of the world into our stupidity"
@oijans,,https://www.youtube.com/watch?v=Y_EAlxWNQN8&lc=UgwYEoTCbMkBENTRj4Z4AaABAg,"If you want to end TACO TWAT's crazy tariffs, just let him know you'll hit him back with a double tariff no matteer what his tariff is."
@Mac-ix4qp,,https://www.youtube.com/watch?v=Y_EAlxWNQN8&lc=UgzOOpyDPcOm8vjSq554AaABAg,"Reality by proclamation, not facts."
@JohnJacob33,,https://www.youtube.com/watch?v=Y_EAlxWNQN8&lc=UgzCBqhfMwEP7EYwSV54AaABAg,Dw is working over time on this narrative
@volfi123,,https://www.youtube.com/watch?v=Y_EAlxWNQN8&lc=UgzwnCP5g45exey4oah4AaABAg,''may''? Are you serious now? You can't even write a video title properly
@Willnottcomply3,,https://www.youtube.com/watch?v=Y_EAlxWNQN8&lc=Ugzvbastqoz4xUX5yAh4AaABAg,Trump just following  Georgia ️ gydestones narrative.
@hc8379-f4f,,https://www.youtube.com/watch?v=Y_EAlxWNQN8&lc=UgzvpQ9X8SGC1hT2XTR4AaABAg,Pretty succint summation of the Trump idiocy.
@Kessoku,,https://www.youtube.com/watch?v=Y_EAlxWNQN8&lc=Ugws3s2f0kbJcYABKRd4AaABAg,TACO
@realvoicever,,https://www.youtube.com/watch?v=Y_EAlxWNQN8&lc=Ugyw3nvf5-jgC6SG1vt4AaABAg,Will back fire sooner or later
@parthsharma10gk.ksharma74,,https://www.youtube.com/watch?v=Y_EAlxWNQN8&lc=Ugyxt1t8Hi0vi412Kgt4AaABAg,When usa apply tariff on china then it's good for everyone but now when applying on European union they said it is bad for the world
@jeryang7657,,https://www.youtube.com/watch?v=Y_EAlxWNQN8&lc=UgzMHtoMEWGmBL9wbvp4AaABAg,"It’s time to take real steps like Trump do. Appease time is over, America workers are suffering."
@wongpeter8744,,https://www.youtube.com/watch?v=Y_EAlxWNQN8&lc=UgxLndUW2iwZycRFsy94AaABAg,What a shocking news
@randyharmon717,,https://www.youtube.com/watch?v=Y_EAlxWNQN8&lc=Ugy6Mtg4omErI1EGZ8Z4AaABAg,"Yeah think, this must of taken a lot of thought and consideration this party isn’t going to end anytime soon and what’s the chances of collateral damage to everyone and everything under the sun. Hold onto your hat and scarf the winds going to be strong on this one hunker down, battle down the hatches they storms a brewing."
@nate3315,,https://www.youtube.com/watch?v=Y_EAlxWNQN8&lc=UgwpTFknVvymC8Ysbud4AaABAg,You'll also notice a pattern of when Trump wants to stir up the media either cause he wants attention or some drama for his reality show or cause he wants people's attention to move from Epstein
@lbarbato6425,,https://www.youtube.com/watch?v=Y_EAlxWNQN8&lc=Ugwx_5j0I0PiU1njQ154AaABAg,"Trump has a hard head hu, why doesn’t he listen to economists?"
@gr8life12,,https://www.youtube.com/watch?v=Y_EAlxWNQN8&lc=UgyCwdvxjrNvAITXobF4AaABAg&pp=0gcJCSMANpG00pGi,We have been hearing this since he was elected
@GamingowyTata,,https://www.youtube.com/watch?v=Y_EAlxWNQN8&lc=Ugw08_1ZxvYvKKidHGF4AaABAg&pp=0gcJCSMANpG00pGi,Taco dumb!
@godyoshida8433,,https://www.youtube.com/watch?v=Y_EAlxWNQN8&lc=UgwKdZX593WPDsnelI14AaABAg&pp=0gcJCSMANpG00pGi,Why's it like you guy's are always running out of time?
@nate3315,,https://www.youtube.com/watch?v=Y_EAlxWNQN8&lc=UgwpTFknVvymC8Ysbud4AaABAg,You'll also notice a pattern of when Trump wants to stir up the media either cause he wants attention or some drama for his reality show or cause he wants people's attention to move from Epstein
@gr8life12,,https://www.youtube.com/watch?v=Y_EAlxWNQN8&lc=UgyCwdvxjrNvAITXobF4AaABAg&pp=0gcJCSMANpG00pGi,We have been hearing this since he was elected
@GamingowyTata,,https://www.youtube.com/watch?v=Y_EAlxWNQN8&lc=Ugw08_1ZxvYvKKidHGF4AaABAg&pp=0gcJCSMANpG00pGi,Taco dumb!
@godyoshida8433,,https://www.youtube.com/watch?v=Y_EAlxWNQN8&lc=UgwKdZX593WPDsnelI14AaABAg&pp=0gcJCSMANpG00pGi,Why's it like you guy's are always running out of time?
@A.P.0000,,https://www.youtube.com/watch?v=Y_EAlxWNQN8&lc=UgxW0R6x1RJFu6G-Dnx4AaABAg&pp=0gcJCSMANpG00pGi,"This is very dangerous for the entire world. In the middle ages an economically starving Europe started one of the most brutal chapters of human history, the Crusades. We tend to see these wars as religious wars and there is a clear religious aspect to them, but what pushed people to go crusading was the messianic hopes that they clinged to. People were poor so they were ready to lash out. Now imagine same situation, happening on a country guided by nationalistic ideology and backed by the worlds greatest military. It will be a disaster when economically battered Americans begin agression for a bigger piece of the pie. I mean the track record of an economically dominant America is already a train wreck from the perspective of peace. The so called ""Pax Americana"" is more like a ""Pox Americana"""
@Simple4u2,,https://www.youtube.com/watch?v=Y_EAlxWNQN8&lc=UgyhoOCVE1xvR_BTebh4AaABAg,Europe first
@ГлебАрсеньев-т2ц,,https://www.youtube.com/watch?v=Y_EAlxWNQN8&lc=UgwciD7gNnIWj0ZVyNl4AaABAg,It's sad. Now I'll have to give up German beer and drink terrible American beer. I don't buy other European goods. I hope I survive.
@randomguy7175,,https://www.youtube.com/watch?v=Y_EAlxWNQN8&lc=UgwV0q4q8COiRylmBeB4AaABAg&pp=0gcJCSMANpG00pGi,Europe is cooked.
@priyeshneema5972,,https://www.youtube.com/watch?v=Y_EAlxWNQN8&lc=UgyVqeYXrbhW9QWNLq54AaABAg,What a president
@humble_african-y6i,,https://www.youtube.com/watch?v=Y_EAlxWNQN8&lc=UgwQVrpoTS8r8W3RP-J4AaABAg,When Pacific route is in full operations and germany gets a recession russia is gonna cut gas supplies to Germany
@theupperroomsolutions5824,,https://www.youtube.com/watch?v=Y_EAlxWNQN8&lc=UgwqjJvxe7Y0DpZPW_Z4AaABAg,India is putting tariff on USA
@porkNbenz,,https://www.youtube.com/watch?v=Y_EAlxWNQN8&lc=UgzmzNPkp7UB0hC5NLd4AaABAg,"you wish  expert doomsday ""economist"""
@antonykotturan7802,,https://www.youtube.com/watch?v=Y_EAlxWNQN8&lc=UgyAO81Ie3jAlrf8Zjx4AaABAg,
@SnrMusic-nb6lj,,https://www.youtube.com/watch?v=Y_EAlxWNQN8&lc=Ugyf4JyfVDLtgEStPSB4AaABAg,your guest seems extremely biased. her laughs and smirks says it all
@IceCream-8888,,https://www.youtube.com/watch?v=Y_EAlxWNQN8&lc=UgyuG5GRRM5c3kLt5Sd4AaABAg,A Sadistic don't care
@robhappe2705,,https://www.youtube.com/watch?v=Y_EAlxWNQN8&lc=Ugz888lPRUWeDe2NAbh4AaABAg,Imports are only 14% of its GDP
@IceCream-8888,,https://www.youtube.com/watch?v=Y_EAlxWNQN8&lc=UgyuG5GRRM5c3kLt5Sd4AaABAg,A Sadistic don't care
@robhappe2705,,https://www.youtube.com/watch?v=Y_EAlxWNQN8&lc=Ugz888lPRUWeDe2NAbh4AaABAg,Imports are only 14% of its GDP
@erikt1713,,https://www.youtube.com/watch?v=Y_EAlxWNQN8&lc=UgyRRV8fHlj0YxKqF-d4AaABAg,"Based on the latest job figures, the economy in the U.S. is rather robust. The tariffs could serve to avoid overheating. However, if there is a tit for tat trade war with tariffs over 50% then it will be an issue, same as with China earlier."
@sionrouge1697,,https://www.youtube.com/watch?v=Y_EAlxWNQN8&lc=UgzQP0Hy_nYM1VH-VCN4AaABAg,"Let Me get this right, the German based station who just had a 30% tarrif rate on it is now wishing a recession on the country that dropped 30% on it."
@No-Voicemail,,https://www.youtube.com/watch?v=Y_EAlxWNQN8&lc=UgzpJGw-qd3MB8ROcpZ4AaABAg,
@bigrig6284,,https://www.youtube.com/watch?v=Y_EAlxWNQN8&lc=UgwBZXT-RiL78N7lpY54AaABAg,Feel like this is ai
@thomasbraun8857,,https://www.youtube.com/watch?v=Y_EAlxWNQN8&lc=UgxbcjC2X4JwCQQxY354AaABAg,.. produce and manufacure in the usa...
@mingho7882,,https://www.youtube.com/watch?v=Y_EAlxWNQN8&lc=UgzD0l9supigC_drixl4AaABAg,"Trump is a super smart person, and he will win."
@bobbucks,,https://www.youtube.com/watch?v=Y_EAlxWNQN8&lc=UgyGsJfk84QMhfspy5J4AaABAg,The DW News guy looks and speaks just like an android. The tech has a long way to go I guess lol
@summer031977,,https://www.youtube.com/watch?v=Y_EAlxWNQN8&lc=UgxvXmZgTzC75aaM_U94AaABAg,Maybe DW should be worried about the EU'S terrible economy instead?
@Serpico1954,,https://www.youtube.com/watch?v=Y_EAlxWNQN8&lc=UgztPoqfz7Hfvo0vvdl4AaABAg&pp=0gcJCSMANpG00pGi,Ah coping…it’s good for the soul…builds character.  I hear a lot of activism/delusion.  A tax expert from UCLA?
@MichaelCummings-ry3pb,,https://www.youtube.com/watch?v=Y_EAlxWNQN8&lc=Ugz4-AHVPF5MxBhiMG14AaABAg,"Too all who  argue the tariffs, stop charging the USA all of your tariffs and ""Value Added"" taxes. Level the playing field and have true equity.  If you do this, the tariffs will go away. But until then, you complain just complain that you are being called out for what you have been doing to the USA for decades."
@kevinjones5457,,https://www.youtube.com/watch?v=Y_EAlxWNQN8&lc=UgwxptSSR0AuB6l6Odp4AaABAg,"This ""professor"" is a dingbat. Let's check in with her in 3 years."
@LOLAllTheTime-v3m,,https://www.youtube.com/watch?v=Y_EAlxWNQN8&lc=UgwKZjuuwzu2VSeIVNZ4AaABAg,We Americans love Trump ️ the best president ever
@Zlaland,,https://www.youtube.com/watch?v=Y_EAlxWNQN8&lc=UgzMXSUDcECexkuu1eF4AaABAg,Europe deserve the tariff
@shdmd2118,,https://www.youtube.com/watch?v=Y_EAlxWNQN8&lc=Ugwjq_2Jh2nL_UwztEV4AaABAg&pp=0gcJCSMANpG00pGi,lol this women works for China?
@Hussar-fm8iy,,https://www.youtube.com/watch?v=Y_EAlxWNQN8&lc=Ugy1aoLHJPqbQF3TDdF4AaABAg,"BND say: The sky is falling The sky is falling for Germany and EU Eurocrats, they will loose billions."
@memetakgun423,,https://www.youtube.com/watch?v=Y_EAlxWNQN8&lc=UgzDLvq-qQbye1P8ZyJ4AaABAg,İRAN 🇮🇷 İRAN 🇮🇷
@iggy5347,,https://www.youtube.com/watch?v=Y_EAlxWNQN8&lc=Ugx99WVuTcn3tGYjpDx4AaABAg,We american will be stronger and our king dollar is no 1. European is a second rate for me and chinese is a third rate country
@王赞赞,,https://www.youtube.com/watch?v=Y_EAlxWNQN8&lc=Ugwn6fwfZDtvs68PxoZ4AaABAg,"Trump is daddy, European must obey him"
@grandpaarock,,https://www.youtube.com/watch?v=Y_EAlxWNQN8&lc=UgxafMpSJ9vhZvUxCC14AaABAg,trump is bluffing and losing
@lisadi_sivad,,https://www.youtube.com/watch?v=Y_EAlxWNQN8&lc=Ugxh5zH_mA2AxGmAKEp4AaABAg,The  looks reasonable from a EU media
@mounishvishnujai5318,,https://www.youtube.com/watch?v=Y_EAlxWNQN8&lc=UgxNFjKESFUmhg52b-F4AaABAg,"no, not for everyone, we in india are good, its you losers who arw in this mess, either do as you are told by your master, or else be smart and make peace with russia and hedge it agaisnt USA"
style-scope,,yt-simple-endpoint href 2,yt-core-attributed-string
@Joelconway34,,https://www.youtube.com/watch?v=KFKpVuWoQLU&lc=UgwOUBQicPafNsQSXjx4AaABAg,"Tariffs make imported goods more expensive, and businesses usually pass that extra cost on to customers. This means people end up paying more for everyday items, which reduces how much they can afford to buy."
@Meredithhawkins013,,https://www.youtube.com/watch?v=KFKpVuWoQLU&lc=UgxQgvk3BpqpvhqMjlR4AaABAg,"I'm glad you made this video. It reminds me of my transformation from a nobody to a good home, $120k monthly and a good daughter full of love. Big thanks to Elizabeth Jane Ross"
@JamesCee,,https://www.youtube.com/watch?v=KFKpVuWoQLU&lc=Ugz73QeVI6HmS41dan94AaABAg,"thanks for posting. i cant see tariffs helping the US. It actually might help a few industries, but if you stand way back and look at this from a global view. Its actually hurting the US economy. Other countries who decide to grow their own economies and trade amongst themselves will cost the US dearly. The bad vibes coming from the US is also costing them by lower tourism. Other countries also are now reluctant to buy American bonds as they are seen to become more risky"
@lukodaian,,https://www.youtube.com/watch?v=KFKpVuWoQLU&lc=UgyZnsYsfbhFsus2JGV4AaABAg,"Learned something new this morning, thank you"
@Sonofbenjamin127,,https://www.youtube.com/watch?v=KFKpVuWoQLU&lc=UgwBq8B5psJALTZX0dx4AaABAg,"My main concern is how to survive all of these financial and political crisis, especially in light of the US political power scuffle. The government has really called things more difficult for its citizens, and we can't sit back and bear all the consequences of the bad governance."
