name,,source,comments
@rebchi,,https://www.youtube.com/watch?v=GjRA1ODmLG8&lc=UgzqxmlUdCpFW6PaG054AaABAg,It is Taco Tuesday after all
@MyAjtaylor,,https://www.youtube.com/watch?v=GjRA1ODmLG8&lc=UgxY7wDXqLC5Xaj1tfN4AaABAg,TACO is a worldwide laughing stock at this point.
@ericbergman7546,,https://www.youtube.com/watch?v=GjRA1ODmLG8&lc=UgyE-nBQO9CGv2Vsmyp4AaABAg,"New tariffs and tax changes just dropped. Trump delays the higher tariffs, but now he's hitting some countries with brand new taxes. This is going to shake up the markets again. I’m seriously worried about how this affects our investments and retirement accounts."
@bluelightningstrike7065,,https://www.youtube.com/watch?v=GjRA1ODmLG8&lc=UgwfKFTFKqKuQqbsEyt4AaABAg,Just call his bluff. He doesn't have any cards
@c.a.savage5689,,https://www.youtube.com/watch?v=GjRA1ODmLG8&lc=UgxVa9INy6fAm3QoNWh4AaABAg,"Bullying and threatening. Yes, that will make for good, stable trade relations. Run, don't walk, from this country as fast as you can. Trading with Trump's America is a lose-lose proposition."
@mildlyAnnoyed123,,https://www.youtube.com/watch?v=GjRA1ODmLG8&lc=UgzJxcsynmZysRX6A7V4AaABAg,When every other leader sounds reasonable next to Trump - America you've got major problems.
@davecooper3238,,https://www.youtube.com/watch?v=GjRA1ODmLG8&lc=UgxFsbB7h7iQsUZhki54AaABAg,How many countries have decided that trade with the USA isn’t worth the bother ?
@JEng-oc1lc,,https://www.youtube.com/watch?v=GjRA1ODmLG8&lc=Ugy55tvwYZ62I4myVTN4AaABAg,TACO again?
@baconstrips6260,,https://www.youtube.com/watch?v=GjRA1ODmLG8&lc=UgyFJYDTXnCDnb3j8iR4AaABAg,Did Mr. Japan even say thank you yet?
@thesweetone,,https://www.youtube.com/watch?v=GjRA1ODmLG8&lc=UgxujLsqGCY-8APwUZd4AaABAg&pp=0gcJCSMANpG00pGi,Trump Always Chickens Out. Abandon USA!
@monicac9643,,https://www.youtube.com/watch?v=GjRA1ODmLG8&lc=UgwAycw63ZkJcyRFv054AaABAg,The rest of the World: No deal. Keep your threats! The world has moved on.
@sarahsokal,,https://www.youtube.com/watch?v=GjRA1ODmLG8&lc=UgwU9_CJwiZNAfDKWa94AaABAg,Market manipulation for the billionaires is what it is....
@danmayberry1185,,https://www.youtube.com/watch?v=GjRA1ODmLG8&lc=Ugz8tbeVfb_UF1bPnM14AaABAg&pp=0gcJCSMANpG00pGi,"Take heart. Canada - America's largest importer and exporter - has seen exports to the US drop to pandemic lows. Despite that hit, new trade has pushed its exports up 1.1% overall. Meanwhile, US exports are down by 6%."
@TR4zest,,https://www.youtube.com/watch?v=GjRA1ODmLG8&lc=UgwxZkadP92_gAWGy3F4AaABAg,Is this TACO again?
@enlightnedsoul4124,,https://www.youtube.com/watch?v=GjRA1ODmLG8&lc=UgzgNZAeGcrrUIbJ_P54AaABAg,90 days.... 90 deals...
@nigelcurtis3421,,https://www.youtube.com/watch?v=GjRA1ODmLG8&lc=UgxOvrzhzQr3p1SgeWF4AaABAg,"What you really meant to say was ;- ""TACO has Absolutely NO IDEA what he is Doing"""
@B_James.A,,https://www.youtube.com/watch?v=GjRA1ODmLG8&lc=UgwlRY2qszQTHPJKzCZ4AaABAg,"Man, America’s getting rough out here, cost of living’s up, taxes are draining us, and it feels like there’s no real break."
@Desi3arms,,https://www.youtube.com/watch?v=GjRA1ODmLG8&lc=UgztmEnTlgIzbkQaQR94AaABAg,It’s not a tax on countries.  It’s a tax on Americans. Why is the media so awful at covering tariffs.
@blackgrandpa7652,,https://www.youtube.com/watch?v=GjRA1ODmLG8&lc=UgyPmYP0rykp3ocowUl4AaABAg&pp=0gcJCSMANpG00pGi,They don't call him T.A.C.O for nothing the  American consumers are gonna pay higher prices through their teeth and some in there Ass
@pragmatica1032,,https://www.youtube.com/watch?v=GjRA1ODmLG8&lc=UgxscLMcnN7ZYlA6tPJ4AaABAg,"""We have these beautiful letters..."" Take a peek at them, they appear quite childish and written in a passive-aggressive tone."
@mildlyAnnoyed123,,https://www.youtube.com/watch?v=GjRA1ODmLG8&lc=UgzJxcsynmZysRX6A7V4AaABAg,When every other leader sounds reasonable next to Trump - America you've got major problems.
@davecooper3238,,https://www.youtube.com/watch?v=GjRA1ODmLG8&lc=UgxFsbB7h7iQsUZhki54AaABAg,How many countries have decided that trade with the USA isn’t worth the bother ?
@JEng-oc1lc,,https://www.youtube.com/watch?v=GjRA1ODmLG8&lc=Ugy55tvwYZ62I4myVTN4AaABAg,TACO again?
@baconstrips6260,,https://www.youtube.com/watch?v=GjRA1ODmLG8&lc=UgyFJYDTXnCDnb3j8iR4AaABAg,Did Mr. Japan even say thank you yet?
@thesweetone,,https://www.youtube.com/watch?v=GjRA1ODmLG8&lc=UgxujLsqGCY-8APwUZd4AaABAg&pp=0gcJCSMANpG00pGi,Trump Always Chickens Out. Abandon USA!
@monicac9643,,https://www.youtube.com/watch?v=GjRA1ODmLG8&lc=UgwAycw63ZkJcyRFv054AaABAg,The rest of the World: No deal. Keep your threats! The world has moved on.
@sarahsokal,,https://www.youtube.com/watch?v=GjRA1ODmLG8&lc=UgwU9_CJwiZNAfDKWa94AaABAg,Market manipulation for the billionaires is what it is....
@danmayberry1185,,https://www.youtube.com/watch?v=GjRA1ODmLG8&lc=Ugz8tbeVfb_UF1bPnM14AaABAg&pp=0gcJCSMANpG00pGi,"Take heart. Canada - America's largest importer and exporter - has seen exports to the US drop to pandemic lows. Despite that hit, new trade has pushed its exports up 1.1% overall. Meanwhile, US exports are down by 6%."
@TR4zest,,https://www.youtube.com/watch?v=GjRA1ODmLG8&lc=UgwxZkadP92_gAWGy3F4AaABAg,Is this TACO again?
@enlightnedsoul4124,,https://www.youtube.com/watch?v=GjRA1ODmLG8&lc=UgzgNZAeGcrrUIbJ_P54AaABAg,90 days.... 90 deals...
@nigelcurtis3421,,https://www.youtube.com/watch?v=GjRA1ODmLG8&lc=UgxOvrzhzQr3p1SgeWF4AaABAg,"What you really meant to say was ;- ""TACO has Absolutely NO IDEA what he is Doing"""
@B_James.A,,https://www.youtube.com/watch?v=GjRA1ODmLG8&lc=UgwlRY2qszQTHPJKzCZ4AaABAg,"Man, America’s getting rough out here, cost of living’s up, taxes are draining us, and it feels like there’s no real break."
@Desi3arms,,https://www.youtube.com/watch?v=GjRA1ODmLG8&lc=UgztmEnTlgIzbkQaQR94AaABAg,It’s not a tax on countries.  It’s a tax on Americans. Why is the media so awful at covering tariffs.
@blackgrandpa7652,,https://www.youtube.com/watch?v=GjRA1ODmLG8&lc=UgyPmYP0rykp3ocowUl4AaABAg&pp=0gcJCSMANpG00pGi,They don't call him T.A.C.O for nothing the  American consumers are gonna pay higher prices through their teeth and some in there Ass
@pragmatica1032,,https://www.youtube.com/watch?v=GjRA1ODmLG8&lc=UgxscLMcnN7ZYlA6tPJ4AaABAg,"""We have these beautiful letters..."" Take a peek at them, they appear quite childish and written in a passive-aggressive tone."
@josephsmith594,,https://www.youtube.com/watch?v=GjRA1ODmLG8&lc=Ugyc0Gtzgpfzo6r677R4AaABAg,"These press briefings are always a depressing clown show. Smug, arrogant, condescending, and usually highly misleading. “We have these beautiful letters”? What’s wrong with these people?"
@TonyKuehler,,https://www.youtube.com/watch?v=GjRA1ODmLG8&lc=UgzlKumE6yTnMlyPCyt4AaABAg,"When I was a child I remember being told that we were a great country because ANYONE could grow up to be President.

Oh my God, they were right."
@TortillasAllTheWayDown,,https://www.youtube.com/watch?v=GjRA1ODmLG8&lc=UgxWM35m7BtzAIV8rbx4AaABAg,How tf do you tax another country?! That is not a thing
@Canoe64,,https://www.youtube.com/watch?v=GjRA1ODmLG8&lc=UgyshVTtgq71Qdndxr54AaABAg,How does Taco not understand that consumers in small poor countries do not have the same buying power as americans?
@thorbennielsen3845,,https://www.youtube.com/watch?v=GjRA1ODmLG8&lc=UgxxGr7bdPqWes6_AOV4AaABAg,He sent a letter to Mr. Japan …
@obsidianjane4413,,https://www.youtube.com/watch?v=GjRA1ODmLG8&lc=UgwLPnbFfSbGJ5RX7eV4AaABAg,TACO! TACO! MAN!
@snowballs2023,,https://www.youtube.com/watch?v=GjRA1ODmLG8&lc=UgyYOCgFpzSTDBpRUGh4AaABAg,Canadian here I like to see our PM rip up Trump's letter on TV. We have deal its USMCA.
@altyt4m,,https://www.youtube.com/watch?v=GjRA1ODmLG8&lc=UgydK2rnuWGG2n4YPu14AaABAg,Penguins are worried
@strikezonefishingadventures,,https://www.youtube.com/watch?v=GjRA1ODmLG8&lc=UgxTlfmlIDLkRUXP1Ql4AaABAg,"Americans are in for such a huge surprise when they go to purchase back-to-school clothing for their children... and when they find out the price of those items have increased 30-40%.  Countries are simply going to cut back on what they sell to the US.  It is going to be a meager Christmas this year for many families.  Between the increased costs and limited supply, the American public is going to really see and feel the full impacts of Donald Trump's tariffs."
@muhammadshahabuldin7830,,https://www.youtube.com/watch?v=GjRA1ODmLG8&lc=Ugw-OQVmJr-hXBs-tbd4AaABAg,He is losing all his friends
@MaximBordyug.,,https://www.youtube.com/watch?v=GjRA1ODmLG8&lc=UgyAUwBAj-EqAvS2WXh4AaABAg,This truly is an exhausting time to be an Аmеricаn
@richietattersall2122,,https://www.youtube.com/watch?v=GjRA1ODmLG8&lc=UgxfVZ664LwCIMEdngt4AaABAg,"President, ""I don't have a CLUE what I'm doing,"" Trump, strikes again."
@ThespaceDr,,https://www.youtube.com/watch?v=GjRA1ODmLG8&lc=Ugwu6zqT1Aa7z_3KgG14AaABAg,The biggest chicken in human history
@crustymilkcap,,https://www.youtube.com/watch?v=GjRA1ODmLG8&lc=UgzLmnTnUsGs7abS8454AaABAg,What a trainwreck
@AmirHossein-u6z,,https://www.youtube.com/watch?v=GjRA1ODmLG8&lc=UgwA0Ow4a6UUZFlckP54AaABAg,How many deadlines we have?  42 left!
@ANIMEWORLD-jg4py,,https://www.youtube.com/watch?v=GjRA1ODmLG8&lc=UgynfyMMD6o0krcUM7B4AaABAg,Taco for a reason
@jjjay3209,,https://www.youtube.com/watch?v=GjRA1ODmLG8&lc=UgyC2w1rOfyGAJPO9qJ4AaABAg,Its so hard to understand how you get the entire US administration mentally ill all at the same time.
@kerstinengelhardt1993,,https://www.youtube.com/watch?v=GjRA1ODmLG8&lc=Ugz-QTRKEYgmtLoNLdZ4AaABAg,Now nobody things anymore about the disaster in Texas. Perfect
@gundamzerostrike,,https://www.youtube.com/watch?v=GjRA1ODmLG8&lc=UgwbYv2h70144Qk_s_F4AaABAg&pp=0gcJCSMANpG00pGi,How long will these taxes hold this time? 1 week? 2 weeks? 1 month? Other countries don't even give a f* anymore.
@AmirHossein-u6z,,https://www.youtube.com/watch?v=GjRA1ODmLG8&lc=UgwA0Ow4a6UUZFlckP54AaABAg,How many deadlines we have?  42 left!
@ANIMEWORLD-jg4py,,https://www.youtube.com/watch?v=GjRA1ODmLG8&lc=UgynfyMMD6o0krcUM7B4AaABAg,Taco for a reason
@jjjay3209,,https://www.youtube.com/watch?v=GjRA1ODmLG8&lc=UgyC2w1rOfyGAJPO9qJ4AaABAg,Its so hard to understand how you get the entire US administration mentally ill all at the same time.
@kerstinengelhardt1993,,https://www.youtube.com/watch?v=GjRA1ODmLG8&lc=Ugz-QTRKEYgmtLoNLdZ4AaABAg,Now nobody things anymore about the disaster in Texas. Perfect
@gundamzerostrike,,https://www.youtube.com/watch?v=GjRA1ODmLG8&lc=UgwbYv2h70144Qk_s_F4AaABAg&pp=0gcJCSMANpG00pGi,How long will these taxes hold this time? 1 week? 2 weeks? 1 month? Other countries don't even give a f* anymore.
@Glendavis28,,https://www.youtube.com/watch?v=GjRA1ODmLG8&lc=UgytCm7CxYY9i2WGjqd4AaABAg&pp=0gcJCSMANpG00pGi,"In my opinion<, according to what I heard in my college macroeconomics class, the reason why lower inflation would hurt the middle class is because, in order for the FED to lower inflation, they have to raise rates, lowering debt, which lowers demand. Any lower prices would be from a decline in demand. If they just get rid of all the money that they printed, reversing our inflation and bringing prices to how they were, our economy would likely collapse overnight. That's why historically, the FED dropping inflation by a percent has had a 2-3 percent decrease in GDP. But the recent surge in demand from inflation is only temporary, as people will eventually adjust and cut back on spending, which we are starting to see. The FED has backed itself into a corner. My advice to anyone feeling the heat in this inflation, just trade long term more than ever, I have made over 720k from day trading with Alease Chabrak in few weeks, this is one of the best medium to backup your assets incase it goes bearish.."
@klchew1963,,https://www.youtube.com/watch?v=GjRA1ODmLG8&lc=Ugxm0yNW3PPzjhTXwo54AaABAg,"The TACO Godfather: ""I'm gonna make you an offer you can't refuse!"""
@ChrisWestin,,https://www.youtube.com/watch?v=GjRA1ODmLG8&lc=UgwqMn04ILVNAkX4dEp4AaABAg,"No one is buying it, Donald."
@bshwin,,https://www.youtube.com/watch?v=GjRA1ODmLG8&lc=UgwmaCbaMZQgU8uMclZ4AaABAg,Trump is an orange incontinent baby
@bythecliff,,https://www.youtube.com/watch?v=GjRA1ODmLG8&lc=Ugz9TmBnHQ5egludmFd4AaABAg,"If those deals were coming so fast, why did they have to send out letters?"
@Mrequine1,,https://www.youtube.com/watch?v=GjRA1ODmLG8&lc=Ugx7XSPBN1VBT_1xSS54AaABAg,It market manipulation nothing to do with trading
@jau5mou5,,https://www.youtube.com/watch?v=GjRA1ODmLG8&lc=UgwGoEZuGAKJYdkmndt4AaABAg,Donnie boy is scared of not bein in the news for 5 minutes
@kerstinengelhardt1993,,https://www.youtube.com/watch?v=GjRA1ODmLG8&lc=Ugwko8TYJcrMnDZwBEJ4AaABAg,I believe trump wants to be on tv everyday thats why he comes up with all the bullshit.  All about attention getting.  Maybe the news station should ignore him?!
@kierans1159,,https://www.youtube.com/watch?v=GjRA1ODmLG8&lc=Ugz3J-_UJnWtpeq5pmZ4AaABAg,"Why is he telling people not in the US how much extra tax people in the US are going to pay? Nobody pays his tariffs except those in the US, nobody else cares."
@killexpert5095,,https://www.youtube.com/watch?v=GjRA1ODmLG8&lc=UgxjPrpttD8aeWk4sWZ4AaABAg,they really nailed the comedic timings in this one lol
@lowcolin,,https://www.youtube.com/watch?v=GjRA1ODmLG8&lc=UgwDEe7SuQfGUhmS5cl4AaABAg,Geez didnt know its TACO Tuesday already
@Manbat420,,https://www.youtube.com/watch?v=GjRA1ODmLG8&lc=UgwrHtfLb_uLzKpVhZp4AaABAg,"""When a clown moves into a palace, he doesn't become a king; the palace becomes a circus"""
@OK247OK,,https://www.youtube.com/watch?v=GjRA1ODmLG8&lc=Ugw3PbwtGYCpHCzP5Wd4AaABAg&pp=0gcJCSMANpG00pGi,Karoline Claptrap
@janetallnutt5767,,https://www.youtube.com/watch?v=GjRA1ODmLG8&lc=Ugy6zXSm4fSMjkK1Mfl4AaABAg,"Negotiating with the president of the United States, Donald Trump, is like playing chess with a pigeon. The bird furiously flaps its wings, knocks over all the pieces while cooing with delight, then defecates on the board and says, ""I won! (Source unknown)"
@bertrandfraser3400,,https://www.youtube.com/watch?v=GjRA1ODmLG8&lc=UgzZY9ZrYKRUypDdr9B4AaABAg,On August first he will pause for 4 month after he will pause for a year after he will pause for two years.
@tatlen,,https://www.youtube.com/watch?v=GjRA1ODmLG8&lc=UgzyYDBIQSSXEk5Hv5V4AaABAg,It's not about tariffs. It's about taxing Americans. He will call off the tariffs once the coffers are overflowing & claim some victory .  These guys are not stupid.
@poncho6784,,https://www.youtube.com/watch?v=GjRA1ODmLG8&lc=UgwZ_QmSZSOhWok22PJ4AaABAg,"As an American, I say stay strong world!   Push back on the extortionist in chief."
@banksiasong,,https://www.youtube.com/watch?v=GjRA1ODmLG8&lc=UgwkJuZdvwx-hESTIv94AaABAg,More strength to BRICS and every other nation other than the US.
@MikeMaker851,,https://www.youtube.com/watch?v=GjRA1ODmLG8&lc=Ugwt2rJlblLppzesIVp4AaABAg,Backed down again? Wow
@ianuy3346,,https://www.youtube.com/watch?v=GjRA1ODmLG8&lc=Ugx7kZalvpS7qIHZYRl4AaABAg,"Honestly, there is a new tariff every 2 months… at this point… what’s the point of business planning when things change so often."
@harryseldom6472,,https://www.youtube.com/watch?v=GjRA1ODmLG8&lc=UgzQzUAoFqizIquRADV4AaABAg,confirmed: negotiating with trump is like playing chess with a hysterical pigeon...
@bimplerouge9389,,https://www.youtube.com/watch?v=GjRA1ODmLG8&lc=Ugx3aV6w5QNDSu7Hw7t4AaABAg,Our country has become bad kubuki theater.   Or more like fake wrestling.   Everyday is something stupider.     Beautiful letters?   Jesus wept.
@kingblicky635,,https://www.youtube.com/watch?v=GjRA1ODmLG8&lc=Ugw3OcYhl0SwkeKnr4l4AaABAg&pp=0gcJCSMANpG00pGi,Taco’s art of the deal in action
@fionawallace580,,https://www.youtube.com/watch?v=GjRA1ODmLG8&lc=UgzNBcLU0QwdFG2ZuyF4AaABAg,Oh look- more market manipulation
@BarrySmithers22,,https://www.youtube.com/watch?v=GjRA1ODmLG8&lc=Ugyn4C1-kpqNkXVgM-54AaABAg,"The penguins on Heard Island dont have a postal service, so it will be hard to receive the tariff letter. Middle Earth and Narnia also dont have a postal servicefor their tariff letter"
@CruzXz,,https://www.youtube.com/watch?v=GjRA1ODmLG8&lc=UgyRL9dz3qPy-33S6d14AaABAg,Dont deal with US  trump back at it again so that country negotiates with him what a joke
@KathleenClarke-q5n,,https://www.youtube.com/watch?v=GjRA1ODmLG8&lc=UgyFzqajuUiymdZNI9J4AaABAg&pp=0gcJCSMANpG00pGi,Want to hear a joke? Netanyahu nominated Trump for a noble peace prize.
@princegroove,,https://www.youtube.com/watch?v=GjRA1ODmLG8&lc=UgwTH7LzKc99KohYlk54AaABAg,If only he had a concept of a plan…
@JohnofthefamilySmith,,https://www.youtube.com/watch?v=GjRA1ODmLG8&lc=UgzV1ek3jfj76tWY6Cx4AaABAg,Taxes are unlawful.
@AmericanInfidel7.62,,https://www.youtube.com/watch?v=GjRA1ODmLG8&lc=Ugz9wO3f4y5k1G1VTaV4AaABAg,Taco taco man. Ii want to be a Taco man.
@tapwater128,,https://www.youtube.com/watch?v=GjRA1ODmLG8&lc=Ugz6Hwlinp3yQTeI1ml4AaABAg,Oh my TACO
@taichi500,,https://www.youtube.com/watch?v=GjRA1ODmLG8&lc=UgwnDUq8zW85aQ8vCld4AaABAg,"Time for many other countries to get together, join BRICS and leave the US to its own delusional ends."
@braxtondamico3599,,https://www.youtube.com/watch?v=GjRA1ODmLG8&lc=UgyxCLWPOcGlpz2_m1F4AaABAg,"Why don’t countries simply stop trading with the YS, yeah you’ll struggle for a period but I’d rather struggle for a period than give in to an evil nation. Y’all can put your heads together and solve this."
@Jakeholden-nf9ow,,https://www.youtube.com/watch?v=GjRA1ODmLG8&lc=Ugxn4z3_hr5BVGPPOMd4AaABAg,These deals and letters sound like the 3 year limited tax break in the BBB.
@peterfisher-01,,https://www.youtube.com/watch?v=GjRA1ODmLG8&lc=UgzMy5wU359BlikOFnd4AaABAg,These tariffs ( a form of tax) are payable by US citizens not by the countries he announced.  Therefore he should announce to everyone in America that prices they pay are going up not down as he originally promised.
@Jakeholden-nf9ow,,https://www.youtube.com/watch?v=GjRA1ODmLG8&lc=Ugxn4z3_hr5BVGPPOMd4AaABAg,These deals and letters sound like the 3 year limited tax break in the BBB.
@peterfisher-01,,https://www.youtube.com/watch?v=GjRA1ODmLG8&lc=UgzMy5wU359BlikOFnd4AaABAg,These tariffs ( a form of tax) are payable by US citizens not by the countries he announced.  Therefore he should announce to everyone in America that prices they pay are going up not down as he originally promised.
@AbdulHaris-rb3hg,,https://www.youtube.com/watch?v=GjRA1ODmLG8&lc=UgzDwm3HgbPPNND3p1V4AaABAg,It's enough to have a poisonous mouth from Nyetanyahu and Trumpet to damage human rights .
@sabinewerner9980,,https://www.youtube.com/watch?v=GjRA1ODmLG8&lc=UgyNUNwPAs5ga3xeTEd4AaABAg,Das ist ja wie im Kindergarten
@Michael-c8b6v,,https://www.youtube.com/watch?v=GjRA1ODmLG8&lc=UgyX9DdjyrXhGoEyd6N4AaABAg,"Worst guy you voted in yet, stop getting youre political views for the Internet people"
@abcxyz-ss6uy,,https://www.youtube.com/watch?v=GjRA1ODmLG8&lc=Ugz9_RuLmQ0m8P_xJ3h4AaABAg,TACO please
@TheLOLWHATTTTTTT,,https://www.youtube.com/watch?v=GjRA1ODmLG8&lc=Ugymtw4GfLzz6kPjQUF4AaABAg,TACO TACO MANNNNN
@malefico0079,,https://www.youtube.com/watch?v=GjRA1ODmLG8&lc=UgwaF9XkCnPUXA5-jUx4AaABAg,"Every time Trunp announce this, my dollar go from 3.60 to 3.40. at this point my coin will had more value than the dollar"
@kevlivinginabox,,https://www.youtube.com/watch?v=GjRA1ODmLG8&lc=UgwtGi0hZSywcPI976h4AaABAg,TACO
@CosmicSpaceBaby,,https://www.youtube.com/watch?v=GjRA1ODmLG8&lc=UgwilJMIaDxspBUb7Zd4AaABAg,The American president speaks like a grade schooler. Such an embarrassment to what was once a progressive nation.
@_unknown_channel_,,https://www.youtube.com/watch?v=GjRA1ODmLG8&lc=UgyAjcz9oUCXF5Ek_O94AaABAg,The rate 25% is too low.
@mokaLARE,,https://www.youtube.com/watch?v=GjRA1ODmLG8&lc=Ugz2loHZMrVLDoIfpN94AaABAg,This guy is lost! Lol
@michaelsummerell8618,,https://www.youtube.com/watch?v=GjRA1ODmLG8&lc=Ugwx78OhATo7qgzgOMJ4AaABAg,Cluck cluck cluck....
@garyinmarz8938,,https://www.youtube.com/watch?v=GjRA1ODmLG8&lc=Ugy4f0GRHn1uy6yQVlN4AaABAg,Improvisation is called winging it day in day out. Remember that job they gave you at 16 but you were under qualified
@jjrrlovesreading,,https://www.youtube.com/watch?v=GjRA1ODmLG8&lc=Ugy3wR3ipxG88mAWHKF4AaABAg,"IF Taiwan still gets high tariff over 30% even TSMC announced investing in USA, I will not believe Trump anymore"
@richardkugler3900,,https://www.youtube.com/watch?v=GjRA1ODmLG8&lc=Ugz1wLUomLXGbyYWvR54AaABAg,"Whatever DonOld is doing,  he personally is making millions.  Its the republican way. And spreading fear and lies"
@drlizzardo4373,,https://www.youtube.com/watch?v=GjRA1ODmLG8&lc=Ugzr_LY9TPikZPkI-Mx4AaABAg,They are not TAXES on these countries .... You sound like any American reporting on Tariffs... is not the countries selling to the US that pay its the importers importing them into the US that get hit.. The US has overplayed their hand and the world are sick of America's BS
@dustinpoirier1827,,https://www.youtube.com/watch?v=GjRA1ODmLG8&lc=UgzF1502sg_7azEzcVd4AaABAg,beautiful letters?  조롱 그자체 ㅋㅋ
@ccccarriemchardy9216,,https://www.youtube.com/watch?v=GjRA1ODmLG8&lc=UgyQLPHMLOR9ooPodBN4AaABAg,Never heard a letter described as....beautiful!.
@MrMustangMan,,https://www.youtube.com/watch?v=GjRA1ODmLG8&lc=UgxqGaM6vF7rC5ksbst4AaABAg,
@heidimueller1039,,https://www.youtube.com/watch?v=GjRA1ODmLG8&lc=Ugy0U-vo84GZKAzSWAB4AaABAg&pp=0gcJCSMANpG00pGi,Is the world just supposed to put up with this madness for the next 3 and a half years? Can we all just do NO CONTACT!
@KPsTboy,,https://www.youtube.com/watch?v=GjRA1ODmLG8&lc=Ugx10kC0MSfuIwokj7J4AaABAg,I certainly hope we're done putting up with this selfcentered country's crap in 3.5 years. Meanwhile other countries hopefully learn not to rely on this hillbilly westworld any longer and pull out of relations.
@weiszeliang4399,,https://www.youtube.com/watch?v=GjRA1ODmLG8&lc=UgyG0Jeq20SFjermJVZ4AaABAg,Im late! But its TACO TACO man!!
@MichaelPhraze,,https://www.youtube.com/watch?v=GjRA1ODmLG8&lc=Ugz6nAP3khA142zsjCF4AaABAg,If BRICS reterlate America is roasted
@ge7714,,https://www.youtube.com/watch?v=GjRA1ODmLG8&lc=Ugwg_j3tf_jj6YjFeXB4AaABAg,It’s not a threat it’s a reciprocal tariff and tax that America has been getting for years amongst them not buying any American goods
@FlyWithMe_666,,https://www.youtube.com/watch?v=GjRA1ODmLG8&lc=UgzNx9PS4NAGR2ZVVR94AaABAg&pp=0gcJCSMANpG00pGi,what a freak show
@ordinarycitizen-v5n,,https://www.youtube.com/watch?v=GjRA1ODmLG8&lc=Ugx-ngGbmUC613TGhKR4AaABAg,"TACO Don. The best way to shut him up is to ignore him completely. How is increasing tariffs that the US people have to pay for such a thing. Ignore him completely. If American companies want what other countries manufacture, let the US eat the tariffs. TACO Don's 90 deals in 90 days is a bust at 0 deals in 90 days. Well done TACO Don."
@Howardg516,,https://www.youtube.com/watch?v=GjRA1ODmLG8&lc=UgyuM3mrBHcHeKtHFEB4AaABAg,"Trump economic policies  could certainly lead to significant economic consequences for the U.S, I’m really concerned about how the current economic crisis and rising inflation have really taken a toll on my portfolio. It's becoming quite worrisome, especially at my age."
@jeffreynicol8287,,https://www.youtube.com/watch?v=GjRA1ODmLG8&lc=UgzJiV6gyTS75b6PfrN4AaABAg,Thought Diaper Don had all the cards?
@FunkMaster-r7g,,https://www.youtube.com/watch?v=GjRA1ODmLG8&lc=UgwiyR0KGFUfc9-4qf14AaABAg&pp=0gcJCSMANpG00pGi,how about going after the root cause: giant corporations getting tax breaks and bail outs and they move production out of the usa anyways
@raymondrosales9162,,https://www.youtube.com/watch?v=GjRA1ODmLG8&lc=UgxiZyQ3XtGCk-Q_fUR4AaABAg,That's how you send signal to trading friends
@gabrielolvera7000,,https://www.youtube.com/watch?v=GjRA1ODmLG8&lc=Ugx4CSjUFX596Qv_Nip4AaABAg,"Yes, tariffs can significantly hurt small businesses. Imposing tariffs on imported goods increases costs for businesses that rely on those imports, potentially forcing them to raise prices, reduce profits, or even shut down. Small businesses often operate on tighter margins than larger corporations and may lack the resources to absorb these cost increases or quickly adapt to new supply chains."
@Monstro-i8q,,https://www.youtube.com/watch?v=GjRA1ODmLG8&lc=UgxK8CBDl6SrVgNud7B4AaABAg,"The orange clown letters are being ignored so much like never before, like we've never seen, etc."
@EyesNeon,,https://www.youtube.com/watch?v=GjRA1ODmLG8&lc=Ugw33WBQIZn5doeCPZp4AaABAg,Got to have a special tariff for any American company that leaves to avoid tariffs.
@matthewcook9404,,https://www.youtube.com/watch?v=GjRA1ODmLG8&lc=UgwGmnVxH9mqvd_1dGt4AaABAg,"So, to get this clear in my head, a Trump trade deal is ….. ( checks notes ) ……. a letter ?!?!"
,,,
@spelunkerd,,https://www.youtube.com/watch?v=GjRA1ODmLG8&lc=Ugzu4xVI9ZFzz-I-2V54AaABAg,"American consumers should be alarmed that their government is doing what it can to get a piece of everything imported. If you aren't convinced that this will be deeply inflationary, you're not paying attention."
@rollandphaneuf2793,,https://www.youtube.com/watch?v=GjRA1ODmLG8&lc=Ugw_RnWHPSCTd3zrn3x4AaABAg,"Canada: Our first delivery of natural gas is destined for Asia. Oddly enough, some American customers have already asked us to absorb the tariffs. They now complain that we are selling for more profit. In three years or less, we will refine the oil ourselves for Canada and sell it all over the world. Previously, we sold it to the United States. They have added a 10% tariff (tax) on the oil we sell them at a discount."
,,,
