name,,source,comments
@tarajoyce3598,,https://www.youtube.com/watch?v=IjKZAzvcL1w&lc=UgzPHyag2mMBp1vxHPR4AaABAg,The goal should be to follow the US Constitution.
@youtubewatcher2,,https://www.youtube.com/watch?v=IjKZAzvcL1w&lc=Ugz9BpRLQX8U4MVUAL14AaABAg,Profiling has always been illegal. Good for the court.
@nursetinalouise,,https://www.youtube.com/watch?v=IjKZAzvcL1w&lc=UgzsXEey6X4igVDZ-gN4AaABAg,When are we going to understand LEGAL immigration takes several years to more than ten years in this nation and it is legal for them to be requesting asylum etc and be going through that process?!
@BobbyHickey,,https://www.youtube.com/watch?v=IjKZAzvcL1w&lc=UgzXAVS5QHkvMifXiq54AaABAg,"From the man constantly calling witch hunt, this is the biggest witch hunt ever!"
@aaronward5612,,https://www.youtube.com/watch?v=IjKZAzvcL1w&lc=Ugx_PQJoh9Q29kl6mSx4AaABAg,A judge orders a traitor to stop breaking the law.... Wonder how that will play out.
@Christian-p4p6e,,https://www.youtube.com/watch?v=IjKZAzvcL1w&lc=UgzaFsLGCfNaOySrYG14AaABAg,From an outsider it doesn't seem to matter what your courts say.
@laurielaw370,,https://www.youtube.com/watch?v=IjKZAzvcL1w&lc=UgzNnYzmBRTvNn0Q0XV4AaABAg&pp=0gcJCSMANpG00pGi,"I'm a white 63 year old woman, I remember back when I was 13/14 year old picking strawberries at a farm in Wisconsin, my friends same age had corn fields and tobacco farms they worked at, lol we thought it was a good way for extra money or to just help out the farmers we knew, this is nothing new, they just want an excuse to go after these poor people trying to make a living for their families"
@JohnnyKashyyyk,,https://www.youtube.com/watch?v=IjKZAzvcL1w&lc=Ugx6vHncZGLC6syI8Wh4AaABAg,How much cheaper and humane would it be to provide quick and easy path to citizenship for law abiding undocumented immigrants?
@JerbPa,,https://www.youtube.com/watch?v=IjKZAzvcL1w&lc=UgyGoyKP9Rc__cKZ6et4AaABAg,This is one thing that irritates me intensely about conservatives. They want to hold every poor person’s feet to the fire over rule following and doing things the “right way” while they pride themselves in finding every manner of loophole and work-around in their own affairs.
@Sunshinesdaisys,,https://www.youtube.com/watch?v=IjKZAzvcL1w&lc=UgyyATe0cfUDL-1RdfR4AaABAg,This should be everywhere! No more racial profiling!!
@MsChristina888,,https://www.youtube.com/watch?v=IjKZAzvcL1w&lc=UgyyHI_uprBHQwx-42R4AaABAg,Children working on farms is not an immigrant thing That has been happening for hundreds of years in the United States. It's part of why we have the summer vacations from school. These children are used on their farms to help the families with their own crops!
@katyeagle6494,,https://www.youtube.com/watch?v=IjKZAzvcL1w&lc=UgwEb-X0PSv7MpDQl5N4AaABAg&pp=0gcJCSMANpG00pGi,"People in civil court, doing it legally, ARE BEING KIDNAPPED!!!"
@TinkerBTea,,https://www.youtube.com/watch?v=IjKZAzvcL1w&lc=Ugypp6KDwnQ6xPiGwmx4AaABAg,"Their eating the files, their eating the list."
@myfalterego1860,,https://www.youtube.com/watch?v=IjKZAzvcL1w&lc=UgwY4D8pB13NQCaR5H14AaABAg,"Finally, the courts are having to address this insanity!"
@ChristineKeup,,https://www.youtube.com/watch?v=IjKZAzvcL1w&lc=UgwlKIzVsql0RPlgoxN4AaABAg,They have already crossed EVERY line!
@tarajoyce3598,,https://www.youtube.com/watch?v=IjKZAzvcL1w&lc=UgzPHyag2mMBp1vxHPR4AaABAg,The goal should be to follow the US Constitution.
@youtubewatcher2,,https://www.youtube.com/watch?v=IjKZAzvcL1w&lc=Ugz9BpRLQX8U4MVUAL14AaABAg,Profiling has always been illegal. Good for the court.
@nursetinalouise,,https://www.youtube.com/watch?v=IjKZAzvcL1w&lc=UgzsXEey6X4igVDZ-gN4AaABAg,When are we going to understand LEGAL immigration takes several years to more than ten years in this nation and it is legal for them to be requesting asylum etc and be going through that process?!
@BobbyHickey,,https://www.youtube.com/watch?v=IjKZAzvcL1w&lc=UgzXAVS5QHkvMifXiq54AaABAg,"From the man constantly calling witch hunt, this is the biggest witch hunt ever!"
@aaronward5612,,https://www.youtube.com/watch?v=IjKZAzvcL1w&lc=Ugx_PQJoh9Q29kl6mSx4AaABAg,A judge orders a traitor to stop breaking the law.... Wonder how that will play out.
@Christian-p4p6e,,https://www.youtube.com/watch?v=IjKZAzvcL1w&lc=UgzaFsLGCfNaOySrYG14AaABAg,From an outsider it doesn't seem to matter what your courts say.
@laurielaw370,,https://www.youtube.com/watch?v=IjKZAzvcL1w&lc=UgzNnYzmBRTvNn0Q0XV4AaABAg&pp=0gcJCSMANpG00pGi,"I'm a white 63 year old woman, I remember back when I was 13/14 year old picking strawberries at a farm in Wisconsin, my friends same age had corn fields and tobacco farms they worked at, lol we thought it was a good way for extra money or to just help out the farmers we knew, this is nothing new, they just want an excuse to go after these poor people trying to make a living for their families"
@JohnnyKashyyyk,,https://www.youtube.com/watch?v=IjKZAzvcL1w&lc=Ugx6vHncZGLC6syI8Wh4AaABAg,How much cheaper and humane would it be to provide quick and easy path to citizenship for law abiding undocumented immigrants?
@nixonarango6364,,https://www.youtube.com/watch?v=IjKZAzvcL1w&lc=Ugy4sIeyiHBJM15mgAB4AaABAg,"We got people that have no criminal record, that came legally and just got there status revoke. Not they are undocumented and worry.  Why are we doing this ? This are families with kids that left their country for a better life."
@larrythibault8952,,https://www.youtube.com/watch?v=IjKZAzvcL1w&lc=UgwD2cA5mtSJLZFux0t4AaABAg,Get rid of Scott Jennings.  He's a broken record of apologism for indefensible behavior by the current GOP.
@AlanBurden-b3d,,https://www.youtube.com/watch?v=IjKZAzvcL1w&lc=UgyAxO-zNFOyKF7obS94AaABAg,"I loathe Scott, sorry buddy, change. Stop selling your soul for nickles and dimes."
@romeshelvin9128,,https://www.youtube.com/watch?v=IjKZAzvcL1w&lc=Ugx1TVnpJT3bpGlLbuN4AaABAg,People chased through fields. People assaulted. People missing and unaccounted for. What does that remind you of?
@ShawnaMarie-y1z,,https://www.youtube.com/watch?v=IjKZAzvcL1w&lc=UgzQGxRxvo4drOmUu894AaABAg&pp=0gcJCSMANpG00pGi,Go far far away Scott. Where are the arrests for gang members and drug dealers.
@singingway,,https://www.youtube.com/watch?v=IjKZAzvcL1w&lc=Ugzh8V7T0S1kgCbTLlV4AaABAg,The woman in orange did a wonderful job facilitating with calm and reason.
@maskedmarvyl4774,,https://www.youtube.com/watch?v=IjKZAzvcL1w&lc=Ugz_Rq7M9UUJRCs7BL54AaABAg,Scott Jennings is just as sickening as ever.  There is no depth to his shamelessness.  I wouldn't trust him to tell me that grass was green without verifying it.
@AllenMorris3,,https://www.youtube.com/watch?v=IjKZAzvcL1w&lc=UgwoQNKMZAgOPz2mQf54AaABAg,They are also detaining people that are in the country legally.
@MR-OS-Hawk,,https://www.youtube.com/watch?v=IjKZAzvcL1w&lc=UgxaYLjEe9xEKj6NoE14AaABAg,"The US GESTAPO will ignore that, too."
@MolonLabeMN,,https://www.youtube.com/watch?v=IjKZAzvcL1w&lc=UgxduPJE2e_zJoWg_ip4AaABAg&pp=0gcJCSMANpG00pGi,"GOP - Greed Over People, Vote"
@Ridgelinehunter007,,https://www.youtube.com/watch?v=IjKZAzvcL1w&lc=UgyR-pJtyFn_ACM0krp4AaABAg,Thank you for the context! Scott Jennings should not be paid to be on your show!
@jasonmartinez9051,,https://www.youtube.com/watch?v=IjKZAzvcL1w&lc=UgwxTFbnkKjkbQ1a9T54AaABAg,"I'm all for enforcing immigration laws as much as any reasonable person. But there are procedures and laws to follow. I say, do it right."
@coreyrobinson8209,,https://www.youtube.com/watch?v=IjKZAzvcL1w&lc=UgyyIalNkUz2Mv4TwXR4AaABAg,Jennings comes on and I have to turn this off. What's the point if he's unwilling or unable to make a good faith argument?
@yasssgawwwd5643,,https://www.youtube.com/watch?v=IjKZAzvcL1w&lc=UgwDmFZw9zUzSirjwbZ4AaABAg,As a U.S. citizen I would be pissed if I was held for 8 hrs with no food or soda.
@AaronLeBaron99,,https://www.youtube.com/watch?v=IjKZAzvcL1w&lc=UgyHpZgWD0CkE2Z7fr14AaABAg,"Scott Jennings, decent people can't stand you."
@swansong419,,https://www.youtube.com/watch?v=IjKZAzvcL1w&lc=UgzDUzWtTo7vYT9g7X54AaABAg,Just do what biden did ignore the judges when they said he couldnt forgive student debt !!!!
@stevemlejnek7073,,https://www.youtube.com/watch?v=IjKZAzvcL1w&lc=Ugx0wDgeTUQT7ceRi0J4AaABAg,"Homan admitted this, saying they don't need probable cause."
@HolzHartwig,,https://www.youtube.com/watch?v=IjKZAzvcL1w&lc=UgxA40qMKiRxgc_9jZF4AaABAg,"Every time I look into cnn and see Trump Mouthpiese Scott Jennings  I ask myself why do you do it,Abby.....and next Question:why am I the fool  to look at CNN....and then I stop it again"
@thegamerguy327,,https://www.youtube.com/watch?v=IjKZAzvcL1w&lc=UgzH6-kNLG7xfDZSQN94AaABAg,Not against deportation but every one has to have due process......
@squarepondstories3895,,https://www.youtube.com/watch?v=IjKZAzvcL1w&lc=UgzYJRpoXxLoIiuwoit4AaABAg,"Gee, wonder what Scott Jennings response is going to be? He's so unbiased."
@elizabethweber390,,https://www.youtube.com/watch?v=IjKZAzvcL1w&lc=UgxFXHFDzNtLLN_HcwB4AaABAg,It’s amazing to be listening to people trying to defend trumps policies by saying he’s trying to get criminals out of the country but you let a criminal run your country and he has been allowed to pardon far worse people so you are just hypocrites
@mjak2009,,https://www.youtube.com/watch?v=IjKZAzvcL1w&lc=UgwFmsngngUS3dhndcB4AaABAg,When Supreme Court became impotent this judge became a hero of democracy
@Hannibal54689,,https://www.youtube.com/watch?v=IjKZAzvcL1w&lc=UgzMlCC81HIkPsJKW_F4AaABAg,Trump don’t care about judges. He believes he’s the King and can do what he pleases
@lesliemartin3051,,https://www.youtube.com/watch?v=IjKZAzvcL1w&lc=UgzTiUAnnCuK9a6evWZ4AaABAg,Has anyone thought maybe the kids where there cause the parents don't want them kidnapped?
@paulallen2849,,https://www.youtube.com/watch?v=IjKZAzvcL1w&lc=UgwHoqtdO12IP7uAmgt4AaABAg,I just stop watching as soon as Scott Jennings  opens his mouth  .
@Angel09-n3u,,https://www.youtube.com/watch?v=IjKZAzvcL1w&lc=Ugw3cTjHoWRFItUtRNF4AaABAg,"Oh, Arthur and Scott, give it up! If he really cared about harming people, he would have stopped this by now. He is trying to reverse naturalization. Scott is pitiful. Smdh."
@gayewatkins2354,,https://www.youtube.com/watch?v=IjKZAzvcL1w&lc=UgwrruhPbav616Oh5hh4AaABAg,"Why doesn't he invite them to a win a $10,000 citizenship, the way he has his $5 Million get out of jail card?"
@RogerV.Kint007-q9k,,https://www.youtube.com/watch?v=IjKZAzvcL1w&lc=Ugy_sOYkyk9SSA56FSh4AaABAg&pp=0gcJCSMANpG00pGi,Reasonable Articulable Suspicion of a crime.
@larryj1048,,https://www.youtube.com/watch?v=IjKZAzvcL1w&lc=UgyzsbaWsCxXvu9ULoh4AaABAg,"For Abby, it must be exhausting dealing with Scott all the time."
@jhersk,,https://www.youtube.com/watch?v=IjKZAzvcL1w&lc=Ugw4HUmyGh0lFIFkyjZ4AaABAg,I will keep saying this til I'm blue in the face: People came here illegally because our immigration system made it impossible for them to come legally. Our politicians of both parties have refused to fix the system for at least 40 years.
@moonlightpixie9976,,https://www.youtube.com/watch?v=IjKZAzvcL1w&lc=Ugyf861mEw8AyEGyIHF4AaABAg,Scott scott scott ️ if anyone needs to smoke a bowl its scott jennings
@rachelerynkalish2207,,https://www.youtube.com/watch?v=IjKZAzvcL1w&lc=UgzYHwrN-oqG-KuGgOJ4AaABAg&pp=0gcJCSMANpG00pGi,I can’t fathom that Scott is still justifying this administration’s policies. I lost over 50 family in Auschwitz. What is happening now is reminiscent and utterly chilling.
@shari9721,,https://www.youtube.com/watch?v=IjKZAzvcL1w&lc=UgxXSW3auWrQYPuaIOx4AaABAg,What EXACTLY does someone who is undocumented LOOK like ? SMFH
@MLTP-y8o,,https://www.youtube.com/watch?v=IjKZAzvcL1w&lc=UgyG6qFpgHhLvP8YAqV4AaABAg,"All ICE agents should wear their work ID numbers on their clothes for public to see, otherwise they have no authority to arrest anyone."
@robertjohnson801,,https://www.youtube.com/watch?v=IjKZAzvcL1w&lc=UgwYO-t_OEZ3229CfvN4AaABAg,Trump doesn't allow legal immigration either. Don't kid yourself.
@fazlulhoq9578,,https://www.youtube.com/watch?v=IjKZAzvcL1w&lc=UgzhvnM-ZTERwczZ-hR4AaABAg,We are concerned about the prices of foods.
@moonlightpixie9976,,https://www.youtube.com/watch?v=IjKZAzvcL1w&lc=Ugyf861mEw8AyEGyIHF4AaABAg,Scott scott scott ️ if anyone needs to smoke a bowl its scott jennings
@shari9721,,https://www.youtube.com/watch?v=IjKZAzvcL1w&lc=UgxXSW3auWrQYPuaIOx4AaABAg,What EXACTLY does someone who is undocumented LOOK like ? SMFH
@MLTP-y8o,,https://www.youtube.com/watch?v=IjKZAzvcL1w&lc=UgyG6qFpgHhLvP8YAqV4AaABAg,"All ICE agents should wear their work ID numbers on their clothes for public to see, otherwise they have no authority to arrest anyone."
@robertjohnson801,,https://www.youtube.com/watch?v=IjKZAzvcL1w&lc=UgwYO-t_OEZ3229CfvN4AaABAg,Trump doesn't allow legal immigration either. Don't kid yourself.
@fazlulhoq9578,,https://www.youtube.com/watch?v=IjKZAzvcL1w&lc=UgzhvnM-ZTERwczZ-hR4AaABAg,We are concerned about the prices of foods.
@patriciacurtis5606,,https://www.youtube.com/watch?v=IjKZAzvcL1w&lc=Ugz610XpBDcomJyEyQt4AaABAg,"It's all about the money at a 160k for each person. Detained, follow the money. It all goes back to a private company who is building these immigration facilities. It's the only one on the stock market, making a lot of money right now..  and that guy said that they need to do it legally how they have no money they are starving.There has to be a better way if we have corruption here without  imagine in those third world.Countries how corrupt trying to obtain citizenship can be and is you need to do your research.  This whole administration needs to be gone.All the republicans are corrupt every Republican.I know is a thief only interested in their own self.Interest and money is the bottom line."
@trendingviews4086,,https://www.youtube.com/watch?v=IjKZAzvcL1w&lc=UgydwLDMd8IOg4VXaKh4AaABAg,When other countries say democracy is not perfect. Americans do not understand. But now they know.
@kaisofine,,https://www.youtube.com/watch?v=IjKZAzvcL1w&lc=UgxBmcgiCvLk_c2Lpct4AaABAg,I wish they would stop allowing Scott on the show
@Copynnpaste,,https://www.youtube.com/watch?v=IjKZAzvcL1w&lc=UgzDZbZ_KHpQlkqwqqV4AaABAg,"Idk why Scott is still in this show. Even when he has nothing factual, he gaslight his way out. Horrible talk show"
@GoldiLoxxxxx,,https://www.youtube.com/watch?v=IjKZAzvcL1w&lc=Ugyqt9yQwz701VppGXd4AaABAg,Illegal child labor??!?  Scott is talking out of his a**
@donhamill5939,,https://www.youtube.com/watch?v=IjKZAzvcL1w&lc=Ugz0CgboXlQlqieqR794AaABAg,A pot farm is not agriculture?
@sarahdzeima5102,,https://www.youtube.com/watch?v=IjKZAzvcL1w&lc=UgyZyAEYuuBuGJsDSjl4AaABAg,"Scott Jennings talking out his arse, again... course, that's all he ever does and y'all still give his lying face a platform. Boo."
@damithasap,,https://www.youtube.com/watch?v=IjKZAzvcL1w&lc=UgxZ4ED4NGTYtD8hqkF4AaABAg,what the hell is that set. why are they in a kitchen set?
@sarahdzeima5102,,https://www.youtube.com/watch?v=IjKZAzvcL1w&lc=UgyZyAEYuuBuGJsDSjl4AaABAg,"Scott Jennings talking out his arse, again... course, that's all he ever does and y'all still give his lying face a platform. Boo."
@damithasap,,https://www.youtube.com/watch?v=IjKZAzvcL1w&lc=UgxZ4ED4NGTYtD8hqkF4AaABAg,what the hell is that set. why are they in a kitchen set?
@DontTrackMe6_6_6,,https://www.youtube.com/watch?v=IjKZAzvcL1w&lc=UgxuORqVTp-Jgo28pqV4AaABAg,Those judges have no power to order them these people are stupid or dead you choose
@brutefury3324,,https://www.youtube.com/watch?v=IjKZAzvcL1w&lc=UgzLArAIsVuSx9dBecN4AaABAg,"These Maga Clowns always having to interpret what Trump says.  Trump is 79, he knows wtf he says."
@RafiJaan-p1w,,https://www.youtube.com/watch?v=IjKZAzvcL1w&lc=UgyOjt7dr7MhV-rtiOp4AaABAg,lol in an hour appeals court will reverse it
@galewosten2010,,https://www.youtube.com/watch?v=IjKZAzvcL1w&lc=Ugw62gdOm5yWzAy-jfF4AaABAg,It is impossible to determine illegal child labor in the field.  Kids work on farms.  I worked on farms in the summer as a kid.  My family hires kids all the time.
@Solitarywtch,,https://www.youtube.com/watch?v=IjKZAzvcL1w&lc=UgxpUBxQU4VsULcP9Z94AaABAg,We are disgusted!!!
@Amir70778,,https://www.youtube.com/watch?v=IjKZAzvcL1w&lc=UgzCUwXU43_0I-fGsj14AaABAg,"What's "" probable cause?"" It seems too subjective. That could be whatever the ICE agent makes up. It should be  something more concrete like a warrant is needed."
@andrewromero5008,,https://www.youtube.com/watch?v=IjKZAzvcL1w&lc=UgyxRC4oYITHDCdWN7J4AaABAg,Scott needs to be removed from all CNN panels.
@brenn619-z1k,,https://www.youtube.com/watch?v=IjKZAzvcL1w&lc=Ugw3UHF5tKRNSMmTP1F4AaABAg,"""In California, it is illegal for children to work on a farm. The state imposes stricter protections than federal law, particularly regarding work hours and safety."" Try again, CNN."
@scwps23,,https://www.youtube.com/watch?v=IjKZAzvcL1w&lc=Ugx1GC-GHbvjyfuZTdx4AaABAg,Wouldn't being in the US illegally be probable cause?
@FaustinoEstrada-g4l,,https://www.youtube.com/watch?v=IjKZAzvcL1w&lc=UgyGP_F6VsWwDZ6OsjZ4AaABAg,Who breaks the law more the  illegals or rich individuals ? Who is behind bars  Black and Browns   or the sons of the rich ?
@timmaloney6441,,https://www.youtube.com/watch?v=IjKZAzvcL1w&lc=UgwiJafunZdG7TExgtF4AaABAg,"If they're here , give them a free path to Citizenship - end of problem . No Drama ."
@randywheeler3914,,https://www.youtube.com/watch?v=IjKZAzvcL1w&lc=UgyrP6i_RV19inQR4Xx4AaABAg,Love Scott Jennings he is the best
@hippiedaze1970,,https://www.youtube.com/watch?v=IjKZAzvcL1w&lc=Ugyo8v00cDT1wgG1DSJ4AaABAg,"As usual, Scott Jennings is the only one on the panel who is making any sense. I only watch CNN if he's on the panel. I'd support him as Vice President."
@americafirst360,,https://www.youtube.com/watch?v=IjKZAzvcL1w&lc=UgxdAm7w_Pymoo9gSAp4AaABAg,AMERICAN LATINOS FOR PRESIDENT TRUMP 🇺🇸🇺🇸🇺🇸🇺🇸🇺🇸🫡🫡🫡🫡
@RhoadesStephen,,https://www.youtube.com/watch?v=IjKZAzvcL1w&lc=UgwMr5E1iSvrVMkma9x4AaABAg,"The government has really made things more difficult for its citizens, and we can't sit back and bear all the consequences of the bad governance. It's obvious we are headed for inflation, it is always the poor who take the hit."
@vickirio,,https://www.youtube.com/watch?v=IjKZAzvcL1w&lc=UgxqJRujCdOK37vwGRF4AaABAg,Sickening I can’t finish watching this video with WEASEL SCOTT JENNINGS flapping his slimy lips
@karenloughman7985,,https://www.youtube.com/watch?v=IjKZAzvcL1w&lc=Ugw8LRurcqr5G2gD_6J4AaABAg,Finally!!!!!
@georgeedwards8579,,https://www.youtube.com/watch?v=IjKZAzvcL1w&lc=UgySvF723qGUD9jb8qt4AaABAg,Where would don Chump be without due process?? Appeal after appeal after appeal... FDJT 🇺🇸
@BeckyClayton-d9u,,https://www.youtube.com/watch?v=IjKZAzvcL1w&lc=UgxCEn7iTlEoRXPJbkB4AaABAg,Due process should have been applied when they broke the law of the land to get here illegally not when you become the hunted and get caught
@hifinsword,,https://www.youtube.com/watch?v=IjKZAzvcL1w&lc=Ugwnxcwp8g9gsghcYM54AaABAg,"At the  min mark it doesn't matter what Trump campaigned on. What matters is the LAW. As President, he is MANDATED to do what he SWORE to do, support and defend the Constitution! That means do what OBAMA's administration did LEGALLY, deport people LEGALLY, not ILLEGALLY, giving them DUE PROCESS!"
@georgeedwards8579,,https://www.youtube.com/watch?v=IjKZAzvcL1w&lc=UgySvF723qGUD9jb8qt4AaABAg,Where would don Chump be without due process?? Appeal after appeal after appeal... FDJT 🇺🇸
@BeckyClayton-d9u,,https://www.youtube.com/watch?v=IjKZAzvcL1w&lc=UgxCEn7iTlEoRXPJbkB4AaABAg,Due process should have been applied when they broke the law of the land to get here illegally not when you become the hunted and get caught
@hifinsword,,https://www.youtube.com/watch?v=IjKZAzvcL1w&lc=Ugwnxcwp8g9gsghcYM54AaABAg,"At the  min mark it doesn't matter what Trump campaigned on. What matters is the LAW. As President, he is MANDATED to do what he SWORE to do, support and defend the Constitution! That means do what OBAMA's administration did LEGALLY, deport people LEGALLY, not ILLEGALLY, giving them DUE PROCESS!"
@applesauce1680,,https://www.youtube.com/watch?v=IjKZAzvcL1w&lc=Ugwjfk-wuwsC6sqPTrt4AaABAg,The pot farm raid was not based on racial profiling. The farm was being investigated by Dept of Labor after being reported for not paying their illegal employees and violation of child labor laws.
@edgardomarrero8694,,https://www.youtube.com/watch?v=IjKZAzvcL1w&lc=UgzqlbcBe0mnkNVzRQl4AaABAg,A criminal president after criminals
@ookpic933,,https://www.youtube.com/watch?v=IjKZAzvcL1w&lc=UgyoUYhiYoeuIxJw-XR4AaABAg,They should go after FOX news hosts. They absolutely look like they don't belong.
@alfredolomeli666,,https://www.youtube.com/watch?v=IjKZAzvcL1w&lc=UgwkFrX7wZwgFoj4SY54AaABAg,once the judge saw the weed raid she like this cross the line
@Terrackhimself,,https://www.youtube.com/watch?v=IjKZAzvcL1w&lc=UgxdgxiEMYw8gGnqIPN4AaABAg,And it means nothing since the supreme court has basically given Trump the green light to ignore laws and court orders.
@eblsymk,,https://www.youtube.com/watch?v=IjKZAzvcL1w&lc=Ugy5KVJpJO7jSp9QDY94AaABAg,ice agents acting like they don't have family and kids is wild
@DrakanHayabusa,,https://www.youtube.com/watch?v=IjKZAzvcL1w&lc=UgwLqw76T1oi0TwmJc14AaABAg,The farm workers should go on strike. Starve us all out.
@webfitz51,,https://www.youtube.com/watch?v=IjKZAzvcL1w&lc=UgyucaA69EMPz6OUL6N4AaABAg,Scott Jennings should be arrested and put in AA
@AlbertGuilmont,,https://www.youtube.com/watch?v=IjKZAzvcL1w&lc=Ugy1oXPLrzyOrbp86Qp4AaABAg,"No problem, in a couple of hours another ""federal judge"" will reinstate Trump's orders."
@rachelcorrie8928,,https://www.youtube.com/watch?v=IjKZAzvcL1w&lc=Ugx6J0vm_6-qT77Dfix4AaABAg,Scott Jennings is pure EVlL.
@D1D2D3D4D5,,https://www.youtube.com/watch?v=IjKZAzvcL1w&lc=Ugy7Hrj0vR5Ye442Pj94AaABAg,"Scott Jennings, the ultimate tool."
@AlRask-j3b,,https://www.youtube.com/watch?v=IjKZAzvcL1w&lc=Ugzz-qFhRzLL6l2hn0Z4AaABAg,"Next it'll be: ""A federal judge ordered Trump to stop being the President"".  Naive fools,  another clown to stall him. Same ending"
@Archer-y5i,,https://www.youtube.com/watch?v=IjKZAzvcL1w&lc=UgyRGviRxxkcjQJBwgx4AaABAg,
@kehcat1,,https://www.youtube.com/watch?v=IjKZAzvcL1w&lc=Ugz8pCSMUgBV3jyOn4x4AaABAg,"Thank you, judge."
@sanchocloset5987,,https://www.youtube.com/watch?v=IjKZAzvcL1w&lc=UgwrhpXN4HVLgXxLVJV4AaABAg,Should we start wearing the star of David and carry papers like the Jews?
@shelleyord5154,,https://www.youtube.com/watch?v=IjKZAzvcL1w&lc=UgyExinsIZAEPWPndIB4AaABAg,This is not normal for a developed country to behave this way!! This should not be normalized in any way and should be universally condemned. I think this behaviour by US government officials is reprehensible!!
@SynthestaN,,https://www.youtube.com/watch?v=IjKZAzvcL1w&lc=Ugwol-GSJ3J0fs87CjB4AaABAg,"this is going to end up pitting local law enforcement against ice, local pd follow the orders of local elected officials mayor and/or the governor, they are not obligated to follow ice orders or assist them so with a court order behind it especially they will follow that"
@billmcnally1011,,https://www.youtube.com/watch?v=IjKZAzvcL1w&lc=UgzHUywB91IsQePv9Kh4AaABAg,like hes going to comply
@SynthestaN,,https://www.youtube.com/watch?v=IjKZAzvcL1w&lc=Ugwol-GSJ3J0fs87CjB4AaABAg,"this is going to end up pitting local law enforcement against ice, local pd follow the orders of local elected officials mayor and/or the governor, they are not obligated to follow ice orders or assist them so with a court order behind it especially they will follow that"
@billmcnally1011,,https://www.youtube.com/watch?v=IjKZAzvcL1w&lc=UgzHUywB91IsQePv9Kh4AaABAg,like hes going to comply
@holymoly_donutshop,,https://www.youtube.com/watch?v=IjKZAzvcL1w&lc=Ugy1BfIJhN8sp4VGIx94AaABAg,Why are they not acknowledging the facts that those 8 children that were recovered from the farm are some of the 300k children that are missing?
@Drgnlrd316,,https://www.youtube.com/watch?v=IjKZAzvcL1w&lc=UgzAS-Vo1Mpa7rQHuKZ4AaABAg,"boo scott jennings boo. Hes clearly a paid mouthpiece for the republican side, and he's terrible at it."
@SupraJoel,,https://www.youtube.com/watch?v=IjKZAzvcL1w&lc=Ugz1RfGSvzltRb6o_0V4AaABAg,"Trump, 'what's a judge?'"
@RalphOrr,,https://www.youtube.com/watch?v=IjKZAzvcL1w&lc=Ugwox9tW9kmy_1wP_Vp4AaABAg,No. The Supreme Court already said stay in your lane. Illegals are leaving.
@butteschool,,https://www.youtube.com/watch?v=IjKZAzvcL1w&lc=UgzsspHzH_N8mH8D1t14AaABAg,Us citizens currently have to prove loyalty to trump to re-enter the US - or to hold government jobs
@ChristineKeup,,https://www.youtube.com/watch?v=IjKZAzvcL1w&lc=Ugz6Z9euZQyji5c8u9Z4AaABAg,Cucumbers and tomatoes and the children are prob with parents because they can’t afford to have them watched by nanny’s during the day
@EnergizerCom,,https://www.youtube.com/watch?v=IjKZAzvcL1w&lc=Ugzsk7em0D4a_k0PdBJ4AaABAg&pp=0gcJCSMANpG00pGi,Racism ice
@HappyGermanShepherd-xi5sq,,https://www.youtube.com/watch?v=IjKZAzvcL1w&lc=UgwDlS2auMj3Z9QkLNt4AaABAg,California
@lunalovegood-m9g,,https://www.youtube.com/watch?v=IjKZAzvcL1w&lc=UgzXpo4lUVjBp_O3FRR4AaABAg,"Legal marijuana farm, and they also grow vegetables. The children were NOT workers. They are children of the workers, who cannot afford daycare. They have to take turns watching the children on their breaks."
@DestinyPuzzanghera,,https://www.youtube.com/watch?v=IjKZAzvcL1w&lc=UgyhAfPPOrUeo0w73Bt4AaABAg,It’s time for a lawsuit and those guys are hypocrites cause Florida is trying to pass a law to make 12 year-old label labor legal if anyone wants to trial labor it’s a Republican
